{
  "_comment": "Worked example for the two-table model. Shows one Genre, one Document that references it, and several Statement Assessments that reference the Document. Illustrates that a single Encyclical carries passages at different registers: most of the text at the genre default (authentic-ordinary), while three central moral judgments rise to the ordinary and universal magisterium. Editorial 'topic' fields are paraphrases, not quotations.",

  "genre": {
    "id": "encyclical",
    "label": "Encyclical",
    "issuerTypes": ["pope"],
    "defaultScope": "universal",
    "defaultRegister": "authentic-ordinary",
    "ceiling": "ordinary-universal",
    "description": "Circular letter of the pope to the universal Church; can invoke the ordinary and universal magisterium."
  },

  "document": {
    "id": "mag:john-paul-ii/evangelium-vitae-1995",
    "title": "Evangelium Vitae",
    "genre": "encyclical",
    "issuerId": "rp:john-paul-ii",
    "issuerType": "pope",
    "date": "1995-03-25",
    "scope": "universal",
    "incipit": "Evangelium Vitae",
    "incipitLang": "la",
    "idStatus": "minted",
    "sigla": "EV",
    "aliases": ["The Gospel of Life"]
  },

  "assessments": [
    {
      "id": "mag:john-paul-ii/evangelium-vitae-1995#*",
      "document": "mag:john-paul-ii/evangelium-vitae-1995",
      "section": "*",
      "topic": "The encyclical as a whole: exhortation and doctrinal synthesis on the value and inviolability of human life.",
      "register": "authentic-ordinary",
      "intent": "non-definitive",
      "assent": "religiosum-obsequium",
      "reformability": "reformable",
      "provenance": {
        "assessedBy": "CMDDR editors",
        "sources": ["Sullivan, Creative Fidelity (1996), ch. 8"],
        "status": "settled",
        "note": "Default register inherited from the genre; the three moral judgments below are the exceptions."
      }
    },
    {
      "id": "mag:john-paul-ii/evangelium-vitae-1995#57",
      "document": "mag:john-paul-ii/evangelium-vitae-1995",
      "section": "57",
      "topic": "The direct and voluntary killing of an innocent human being is always gravely immoral.",
      "register": "ordinary-universal",
      "intent": "definitive",
      "object": "revealed",
      "assent": "fides-divina-et-catholica",
      "reformability": "irreformable",
      "provenance": {
        "assessedBy": "CMDDR editors",
        "sources": ["Sullivan, Creative Fidelity (1996), ch. 8"],
        "status": "contested",
        "note": "Confirmed 'by the authority which Christ conferred upon Peter and his Successors, in communion with the Bishops' — i.e. by the ordinary and universal magisterium. Primary-vs-secondary object debated."
      }
    },
    {
      "id": "mag:john-paul-ii/evangelium-vitae-1995#62",
      "document": "mag:john-paul-ii/evangelium-vitae-1995",
      "section": "62",
      "topic": "Direct abortion, as an end or a means, is always gravely immoral.",
      "register": "ordinary-universal",
      "intent": "definitive",
      "object": "revealed",
      "assent": "fides-divina-et-catholica",
      "reformability": "irreformable",
      "provenance": {
        "assessedBy": "CMDDR editors",
        "sources": ["Sullivan, Creative Fidelity (1996), ch. 8"],
        "status": "contested",
        "note": "Declared taught 'by the ordinary and universal Magisterium.'"
      }
    },
    {
      "id": "mag:john-paul-ii/evangelium-vitae-1995#65",
      "document": "mag:john-paul-ii/evangelium-vitae-1995",
      "section": "65",
      "topic": "Euthanasia is a grave violation of the law of God.",
      "register": "ordinary-universal",
      "intent": "definitive",
      "object": "secondary",
      "assent": "fides-ecclesiastica",
      "reformability": "irreformable",
      "provenance": {
        "assessedBy": "CMDDR editors",
        "sources": ["Sullivan, Creative Fidelity (1996), ch. 8"],
        "status": "contested",
        "note": "Taught 'in harmony with the Magisterium of my Predecessors and in communion with the Bishops.' Object classification debated."
      }
    }
  ]
}
